"Date","Time","Post text","Post type","Flair","# upvotes","# comments","# awards","Post tone","Post URL","Community name","Community members","Author nick","Years of membership","# Post Karma","# Comment Karma","# Awardee Karma","Author profile URL"
"2023-05-23","14:19:24","Request for my good boy Benny. Benny passed on last night. He went in to the vet for neck and found a massive brain tumor. Benny was a client of mine but I truly loved him as my own. His wiggles and kisses cured bad days, frustration and grumpiness. I miss my little sausage man so much.","link","REQUEST","54","6","0","neutral","https://reddit.com/r/RainbowBridgeBabies/comments/13ppx9a/request_for_my_good_boy_benny_benny_passed_on/","r/RainbowBridgeBabies","4549","Equalakitty","1.8493150684931507","9876","14048","552","https://reddit.com/user/Equalakitty/"
"2023-05-31","05:38:39","What are your thoughts on whether grumpy older individuals were always grumpy since their younger days, or if their grumpiness developed gradually over time?","text","","1","10","0","neutral","https://reddit.com/r/AskReddit/comments/13wdjfg/what_are_your_thoughts_on_whether_grumpy_older/","r/AskReddit","41302907","wanttogoabroad","4.221917808219178","252","1013","0","https://reddit.com/user/wanttogoabroad/"
"2023-05-14","09:50:38","Loki Doesn't Wanna Play ""Get Help"" so I fed him a Snickers candy bar to calm his grumpiness. 😆","link","SCREENSHOTS","88","8","0","neutral","https://reddit.com/r/CharacterAI/comments/13h81an/loki_doesnt_wanna_play_get_help_so_i_fed_him_a/","r/CharacterAI","177854","contentcatlady","2.5232876712328767","619","973","51","https://reddit.com/user/contentcatlady/"
"2023-04-08","17:39:20","Todays episode of Dutton includes Nellie as a mildly annoyed big sister. Sound up to hear her grumpiness.","video","","244","14","0","neutral","https://reddit.com/r/bernesemountaindogs/comments/12fsv63/todays_episode_of_dutton_includes_nellie_as_a/","r/bernesemountaindogs","52735","johnstoneak","4.8493150684931505","12721","7030","423","https://reddit.com/user/johnstoneak/"
"2023-05-04","06:11:15","Grumpiness hurting my relationship","text","","6","3","0","neutral","https://reddit.com/r/stopsmoking/comments/137bvtu/grumpiness_hurting_my_relationship/","r/stopsmoking","151035","squidgame23","1.643835616438356","165","273","0","https://reddit.com/user/squidgame23/"
"2023-04-01","10:30:34","Newest member Lily showing CJ that she can counteract the grumpiness with cuteness.","video","","69","4","0","neutral","https://reddit.com/r/ColonyCats/comments/128i8gc/newest_member_lily_showing_cj_that_she_can/","r/ColonyCats","5834","Disgruntled_Viking","4.271232876712329","71094","66298","3219","https://reddit.com/user/Disgruntled_Viking/"
"2023-02-13","13:59:22","Prayers for My Anger/Grumpiness","text","Prayer Request","20","9","0","neutral","https://reddit.com/r/PrayerTeam_amen/comments/1118vbz/prayers_for_my_angergrumpiness/","r/PrayerTeam_amen","10434","rdundon","9.027397260273972","193","2717","73","https://reddit.com/user/rdundon/"
"2023-04-06","00:17:10","Cheater today-they're gone now tho (excuse grumpiness had a migraine)","video","","9","1","0","neutral","https://reddit.com/r/Chivalry2/comments/12d31e2/cheater_todaytheyre_gone_now_tho_excuse/","r/Chivalry2","75818","ElectraCal","4.3123287671232875","4","5","0","https://reddit.com/user/ElectraCal/"
"2023-01-15","02:28:50","End of Day Grumpiness/Frustration Trick (for those on Stimulant Medication)","text","Tips/Suggestions","15","8","0","neutral","https://reddit.com/r/ADHD/comments/10c82nd/end_of_day_grumpinessfrustration_trick_for_those/","r/ADHD","1660275","mojoxyt","3.578082191780822","120","76","13","https://reddit.com/user/mojoxyt/"
"2023-03-13","17:46:00","No pug could express his grumpiness quite like Willie (13) He would have turned 14 this week.","link","RIP","18","6","0","neutral","https://reddit.com/r/OldManDog/comments/11qg9vo/no_pug_could_express_his_grumpiness_quite_like/","r/OldManDog","125802","Roseartcrantz","2.408219178082192","2954","33990","125","https://reddit.com/user/Roseartcrantz/"
"2023-04-20","16:02:55","Mass hysteria, grumpiness ensues as Florida Division of Emergency Management ruins everyone’s night","link","","1","1","0","neutral","https://reddit.com/r/OrlandoWeekly/comments/12t66z2/mass_hysteria_grumpiness_ensues_as_florida/","r/OrlandoWeekly","65","BitAffectionate3203","1.558904109589041","955","861","15","https://reddit.com/user/BitAffectionate3203/"
"2023-04-03","06:53:30","Anyone experience grumpiness, become easily irritated or just bad mood in general after catching up on sleep?","text","","1","2","0","neutral","https://reddit.com/r/NoStupidQuestions/comments/12ac6ed/anyone_experience_grumpiness_become_easily/","r/NoStupidQuestions","3511899","lohord_sfw","5.635616438356164","49531","13812","277","https://reddit.com/user/lohord_sfw/"
"2023-06-11","23:24:39","Rainbow at work this morning. They still make this grumpy carpenter feel like a little kid.","link","Picture","839","64","0","neutral","https://reddit.com/r/Construction/comments/1478rib/rainbow_at_work_this_morning_they_still_make_this/","r/Construction","237526","Practical_Anybody899","0.13150684931506848","446","706","7","https://reddit.com/user/Practical_Anybody899/"
"2023-03-01","20:12:02","The very thing I want I don’t get because of my moods and general grumpiness","text","","5","3","0","neutral","https://reddit.com/r/Anger/comments/11fgdtf/the_very_thing_i_want_i_dont_get_because_of_my/","r/Anger","38050","Avacado-Burger","0.6931506849315069","84","1066","0","https://reddit.com/user/Avacado-Burger/"
"2023-01-31","13:31:17","The anime is so wholesome it sold me in just these three first episodes. Fel is best boy despite his grumpiness.","link","","48","6","0","neutral","https://reddit.com/r/TondemoSkill/comments/10pz3q9/the_anime_is_so_wholesome_it_sold_me_in_just/","r/TondemoSkill","455","ToboeArticWolf","3.841095890410959","2525","609","38","https://reddit.com/user/ToboeArticWolf/"
"2023-01-29","21:37:41","How to combat grumpiness so I can fast longer?","text","Seeking Advice ","9","18","0","neutral","https://reddit.com/r/intermittentfasting/comments/10ojezz/how_to_combat_grumpiness_so_i_can_fast_longer/","r/intermittentfasting","877890","casualnapper","3.2356164383561645","100","160","0","https://reddit.com/user/casualnapper/"
"2023-05-19","12:11:57","Older grumpy and abusive people are one of the biggest problems in this industry","text","Informative","463","179","0","neutral","https://reddit.com/r/Construction/comments/13ltp5e/older_grumpy_and_abusive_people_are_one_of_the/","r/Construction","237526","SkinnySteve123","0.15342465753424658","534","1058","0","https://reddit.com/user/SkinnySteve123/"
"2023-05-07","13:41:56","Not my cat. I call him Günther, because he’s a grumpy old man. I think the poor old boy is a stray. But I can’t let him in because my own cats are a bit scared of him:(","link","","3768","138","0","neutral","https://reddit.com/r/notmycat/comments/13ao1sv/not_my_cat_i_call_him_günther_because_hes_a/","r/notmycat","201537","Accomplished-Spot-17","2.652054794520548","5224","14836","193","https://reddit.com/user/Accomplished-Spot-17/"
"2023-05-22","10:56:40","Coconut: *tiny, pitiful, Mom-I’m-Starving squeaks* Mom: “You just had dinner and a giant treat.” Coconut: 😠 *grumpy huff* *storms off*","video","","1911","72","0","neutral","https://reddit.com/r/CatsWhoSqueak/comments/13onkli/coconut_tiny_pitiful_momimstarving_squeaks_mom/","r/CatsWhoSqueak","140652","SunlitLavenderFields","2.9424657534246577","109082","96700","3841","https://reddit.com/user/SunlitLavenderFields/"
"2023-06-06","21:34:23","Grumpy husky is tired of your bullsh*t","link","","952","28","0","neutral","https://reddit.com/r/husky/comments/142u01w/grumpy_husky_is_tired_of_your_bullsht/","r/husky","157603","nolalaw9781","1.5095890410958903","5505","7614","59","https://reddit.com/user/nolalaw9781/"
"2023-06-09","12:14:33","Dr house must be forever constipated from all the codeine he takes. That explains why he's always so grumpy.","text","","368","36","0","neutral","https://reddit.com/r/Showerthoughts/comments/1453m2t/dr_house_must_be_forever_constipated_from_all_the/","r/Showerthoughts","27485548","Critical-Loss2549","2.408219178082192","214","1720","0","https://reddit.com/user/Critical-Loss2549/"
"2023-05-04","17:36:55","I need a 'grumpy old man' type name!","text",":change:Name Change ","219","429","0","neutral","https://reddit.com/r/namenerds/comments/137u8lo/i_need_a_grumpy_old_man_type_name/","r/namenerds","247248","areyoufuckingwme","4.142465753424657","158","9968","61","https://reddit.com/user/areyoufuckingwme/"
"2023-06-06","21:48:14","Amber gets ""grumpy"" when Krystle didn't like Chef Mike's taquitos Amber plated","video","Krystal Era 🤫","159","46","0","neutral","https://reddit.com/r/ambbabies/comments/142ud4p/amber_gets_grumpy_when_krystle_didnt_like_chef/","r/ambbabies","14950","BiteOhHoney","1.0438356164383562","5582","44550","474","https://reddit.com/user/BiteOhHoney/"
"2023-06-12","00:58:33","just a handsome grumpy fella","link","","985","11","0","neutral","https://reddit.com/r/SupermodelCats/comments/147ar9h/just_a_handsome_grumpy_fella/","r/SupermodelCats","321101","Effective-Throat-221","1.095890410958904","4335","760","45","https://reddit.com/user/Effective-Throat-221/"
"2023-06-12","12:22:23","The grumpy protector starter pack","link","","354","16","0","neutral","https://reddit.com/r/starterpacks/comments/147ms99/the_grumpy_protector_starter_pack/","r/starterpacks","4791667","the_chilldad","0.01643835616438356","980","1295","0","https://reddit.com/user/the_chilldad/"
"2023-06-06","04:13:58","Spud Being Grumpy Because I Woke Her Up","link","Pics!","601","17","0","neutral","https://reddit.com/r/foxes/comments/14237yx/spud_being_grumpy_because_i_woke_her_up/","r/foxes","185284","Potential-Most-3581","2.484931506849315","10486","16008","968","https://reddit.com/user/Potential-Most-3581/"
"2023-06-11","19:34:49","Ninja being grumpy","video","","372","16","0","neutral","https://reddit.com/r/Degus/comments/14730f5/ninja_being_grumpy/","r/Degus","4834","StellerJayGG","0.336986301369863","507","159","0","https://reddit.com/user/StellerJayGG/"
"2023-01-09","22:33:02","recently my husband has been getting me down with constant complaining, grumpiness, neediness and general negative energy","text","man rant 🚹","15","3","0","neutral","https://reddit.com/r/breakingmom/comments/107sd9k/recently_my_husband_has_been_getting_me_down_with/","r/breakingmom","114614","throw0012","1.4191780821917808","1555","3592","65","https://reddit.com/user/throw0012/"
"2023-06-02","00:08:52","Lil sketcheroo of the poor lad's recent grumpy stream","link","Art","385","23","0","neutral","https://reddit.com/r/Destiny/comments/13xxqif/lil_sketcheroo_of_the_poor_lads_recent_grumpy/","r/Destiny","185124","Suffering69420","0.9397260273972603","879","575","120","https://reddit.com/user/Suffering69420/"
"2023-01-15","02:26:27","Cheerful people of Reddit, how do you hide/control grumpiness?","text","","2","12","0","neutral","https://reddit.com/r/AskReddit/comments/10c80vd/cheerful_people_of_reddit_how_do_you_hidecontrol/","r/AskReddit","41302966","Kleptarian","1.6958904109589041","17650","10748","816","https://reddit.com/user/Kleptarian/"
"2023-05-31","22:30:24","Kenny turned 15 yesterday. We adore our grumpy foster failure and are lucky to have had him for the past year. (Late post, as his birthday was April 18)","link","Happy Birthday!","206","33","1","neutral","https://reddit.com/r/OldManDog/comments/13x0acg/kenny_turned_15_yesterday_we_adore_our_grumpy/","r/OldManDog","125802","CableVannotFBI","2.1342465753424658","748","27534","110","https://reddit.com/user/CableVannotFBI/"
"2023-01-10","04:15:49","Post bath time grumpiness.","link","Pom Pic","61","0","0","neutral","https://reddit.com/r/Pomeranians/comments/10807jw/post_bath_time_grumpiness/","r/Pomeranians","45477","keshladesh","2.56986301369863","270","29","0","https://reddit.com/user/keshladesh/"
"2023-06-08","22:31:21","POV; Valentine your (insert relationship) had just woke up this morning, and because she has no cooking ability you ask what she wants to have for breakfast- being the person she is she say ‘Ice cream’ and she now grumpy because you won’t let her have that for breakfast- wdyd?","link","👀 Miscellaneous POV 👀","5","87","0","neutral","https://reddit.com/r/GachaClubPOV/comments/144ncvj/pov_valentine_your_insert_relationship_had_just/","r/GachaClubPOV","2679","Cupidsnewesthelper","0.2","462","1890","0","https://reddit.com/user/Cupidsnewesthelper/"
"2023-06-08","22:59:36","My Grumpy girl Yeets herself off ledge","video","ANGRY/PANCAKE HOG","162","16","0","neutral","https://reddit.com/r/hognosesnakes/comments/144o248/my_grumpy_girl_yeets_herself_off_ledge/","r/hognosesnakes","17446","puddyspud","11.161643835616438","10548","46703","824","https://reddit.com/user/puddyspud/"
"2023-05-20","19:34:31","Need a break from alpha holes and grumpy, broody men","text","Book Request","76","75","0","neutral","https://reddit.com/r/RomanceBooks/comments/13n40ff/need_a_break_from_alpha_holes_and_grumpy_broody/","r/RomanceBooks","175041","Alternative_Treacle","3.4383561643835616","2840","8362","103","https://reddit.com/user/Alternative_Treacle/"
"2023-06-09","00:30:06","Going old school and calling everyone on the left dirty hippies, gonna tell them to get a job regardless of employment status because I’m a grumpy old man trapped in a 20 year olds body.","text","Shitpost","32","32","0","neutral","https://reddit.com/r/ConservativeKiwi/comments/144q6vp/going_old_school_and_calling_everyone_on_the_left/","r/ConservativeKiwi","8359","Kiwiwithnoleftwing","2.786301369863014","1002","749","185","https://reddit.com/user/Kiwiwithnoleftwing/"
"2023-05-21","03:01:08","my baby crossed the rainbow bridge today. i wanted to commemorate her life by sharing pictures from the first one i received of her to her being grumpy at the vet yesterday. thank you daisy mae for helping me through my hardest nights and being the cutest (and most mischievous) bun i have ever met","link","RIP","806","27","1","neutral","https://reddit.com/r/Rabbits/comments/13nh1p2/my_baby_crossed_the_rainbow_bridge_today_i_wanted/","r/Rabbits","318559","bisexualpromqueen","1.252054794520548","799","1992","13","https://reddit.com/user/bisexualpromqueen/"
"2023-05-31","02:36:54","Is Reece Sheersmith as grumpy as he seems?","text","STEVE & REECE","40","52","0","neutral","https://reddit.com/r/insideno9/comments/13w9won/is_reece_sheersmith_as_grumpy_as_he_seems/","r/insideno9","10983","LilNardoDaVinci","3.0273972602739727","273117","67390","6884","https://reddit.com/user/LilNardoDaVinci/"
"2023-06-06","14:21:05","My grumpy bun children","link","Bun Glare ","787","8","0","neutral","https://reddit.com/r/MurderBuns/comments/142hnhz/my_grumpy_bun_children/","r/MurderBuns","29013","CyberRansyBaka","5.8","589","148","0","https://reddit.com/user/CyberRansyBaka/"
"2023-06-09","17:12:44","My PIMI wife keeps noticing that I (PIMO) am always cranky and grumpy.","text","Venting","54","24","0","neutral","https://reddit.com/r/exjw/comments/145az0c/my_pimi_wife_keeps_noticing_that_i_pimo_am_always/","r/exjw","87125","4lan5eth","2.7424657534246575","2808","30979","401","https://reddit.com/user/4lan5eth/"
"2023-06-10","00:01:58","Just gotta love grumpy old man Bernard","link","Meme","216","12","0","neutral","https://reddit.com/r/kingdomcome/comments/145l1me/just_gotta_love_grumpy_old_man_bernard/","r/kingdomcome","159582","Pleasant_Extreme_398","0.7835616438356164","8435","1939","0","https://reddit.com/user/Pleasant_Extreme_398/"
"2023-06-09","14:21:30","I woke up Mau Mau for this pic, which is why she looks kinda grumpy. It is her 22nd birthday today. May all of our magical friends be blessed by Venus and showered with love. SMIB.","link","Familiar Friday","233","10","0","neutral","https://reddit.com/r/Witch/comments/1456l37/i_woke_up_mau_mau_for_this_pic_which_is_why_she/","r/Witch","97935","kai-ote","3.3232876712328765","384670","94651","27097","https://reddit.com/user/kai-ote/"
"2023-06-08","12:53:18","Hanging low during grumpy lady adventure.","link","","720","7","0","neutral","https://reddit.com/r/PouchCatatoes/comments/1448hk0/hanging_low_during_grumpy_lady_adventure/","r/PouchCatatoes","37441","Nailkita","6.93972602739726","62698","58108","1163","https://reddit.com/user/Nailkita/"
"2023-04-30","10:44:27","I woke him up from his nap… I have never seen a more grumpy face","link","","2830","40","0","neutral","https://reddit.com/r/Rabbits/comments/133lxd2/i_woke_him_up_from_his_nap_i_have_never_seen_a/","r/Rabbits","318559","deltadelta199","4.989041095890411","698277","91074","20830","https://reddit.com/user/deltadelta199/"
"2023-02-27","18:28:09","Maximum Grumpiness (OC)","link","","1","0","0","neutral","https://reddit.com/r/u_LNK1264/comments/11dix6e/maximum_grumpiness_oc/","u/LNK1264","0","LNK1264","0.5972602739726027","253","4697","0","https://reddit.com/user/LNK1264/"
"2023-06-06","22:50:32","Grumpy duo","link","","332","9","0","neutral","https://reddit.com/r/PallasCats/comments/142vyhd/grumpy_duo/","r/PallasCats","14652","fullnameqwertyu","5.208219178082191","1108783","16274","7251","https://reddit.com/user/fullnameqwertyu/"
"2022-09-16","02:46:41","Delayed grumpiness at secondchanceswildlife","video","","96","7","1","neutral","https://reddit.com/r/Skunks/comments/xffg39/delayed_grumpiness_at_secondchanceswildlife/","r/Skunks","4314","callunquirka","5.676712328767123","16235","21071","1519","https://reddit.com/user/callunquirka/"
"2023-04-25","12:14:41","I think for all it’s strengths, the greatest conceit of the Percy Jackson books is leading me to craft a mental image of Dionysus as a grumpy middle aged alcoholic instead of the madness-inducing chthonic twink he is meant to be","link","Meme","1561","79","0","neutral","https://reddit.com/r/osp/comments/12yhme1/i_think_for_all_its_strengths_the_greatest/","r/osp","22310","2_cats_high_5ing","2.9506849315068493","22334","23408","852","https://reddit.com/user/2_cats_high_5ing/"
"2023-05-05","23:54:51","Grumpy old man rant incoming: Does no one wear their actual home jerseys at ya know…. Home anymore in the NBA!?","text","bad shit","252","105","0","neutral","https://reddit.com/r/billsimmons/comments/1395pqv/grumpy_old_man_rant_incoming_does_no_one_wear/","r/billsimmons","42340","WESandCASEYtruther","0.4986301369863014","4444","7656","0","https://reddit.com/user/WESandCASEYtruther/"
"2023-06-10","17:28:32","Grumpy starter or beginner mistake?","text","Beginner Questions","15","28","0","neutral","https://reddit.com/r/golf/comments/1465z0p/grumpy_starter_or_beginner_mistake/","r/golf","685863","SlimPoppa9014","1.8876712328767122","2","52","0","https://reddit.com/user/SlimPoppa9014/"
"2023-05-11","18:13:20","This is an Aurora appreciation post and her looking like a grumpy gremlin in most photos. I adore that face by the way.","link","","1383","27","0","neutral","https://reddit.com/r/mainecoons/comments/13ev771/this_is_an_aurora_appreciation_post_and_her/","r/mainecoons","100979","Greeneyedisaster","1.063013698630137","12214","810","145","https://reddit.com/user/Greeneyedisaster/"
"2023-05-03","19:19:58","Grumpy older people and self checkout","text","Employee Story","116","148","0","neutral","https://reddit.com/r/Lowes/comments/136wp6q/grumpy_older_people_and_self_checkout/","r/Lowes","44860","Mazeinc-Mizukage","1.0547945205479452","74","58","0","https://reddit.com/user/Mazeinc-Mizukage/"
"2023-05-27","22:53:50","Pooh just woke up. Do you think he’s grumpy? 😂","link","","293","17","0","neutral","https://reddit.com/r/MurderBuns/comments/13tkn3w/pooh_just_woke_up_do_you_think_hes_grumpy/","r/MurderBuns","29013","MySillyHamster","1.6767123287671233","5583","8211","284","https://reddit.com/user/MySillyHamster/"
"2023-06-08","22:37:08","Grumpy morning routines","link","","33","22","0","neutral","https://reddit.com/r/cecilybauchman/comments/144nic1/grumpy_morning_routines/","r/cecilybauchman","989","LeftContract6612","1.1013698630136985","65","15352","0","https://reddit.com/user/LeftContract6612/"
"2023-05-01","09:27:49","My ex hated my cat since he thought he was a grumpy old man-","link","","1681","44","0","neutral","https://reddit.com/r/teefies/comments/134hlu4/my_ex_hated_my_cat_since_he_thought_he_was_a/","r/teefies","337787","rosierottenx","1.9205479452054794","2023","254","0","https://reddit.com/user/rosierottenx/"
"2023-05-27","04:44:56","[Spoiler media] A very grumpy half-elf","link","Spoiler Media","472","13","0","neutral","https://reddit.com/r/Re_Zero/comments/13sy6sv/spoiler_media_a_very_grumpy_halfelf/","r/Re_Zero","193951","Entire-Psychology856","0.29315068493150687","726","67","0","https://reddit.com/user/Entire-Psychology856/"
"2023-05-03","12:34:19","Tired of people telling me I’m “grumpy” or “upset” when I’m not","text","Vent/Rant","439","71","0","neutral","https://reddit.com/r/AutismInWomen/comments/136j9rx/tired_of_people_telling_me_im_grumpy_or_upset/","r/AutismInWomen","84124","dethsdream","3.767123287671233","1860","22702","295","https://reddit.com/user/dethsdream/"
"2023-06-10","20:20:44","Maybe this fits here maybe not :3 (pls ignore grumpy face idk how to smile properly x3)","link","","22","19","0","neutral","https://reddit.com/r/FemboyThighsClub/comments/146a1g6/maybe_this_fits_here_maybe_not_3_pls_ignore/","r/FemboyThighsClub","2403","ClownCatboy","0.26301369863013696","692","83","0","https://reddit.com/user/ClownCatboy/"
"2023-06-03","14:20:07","What are your favourite grumpy/sunshine series/movie/manga etc?","text","Recommendation","25","29","0","neutral","https://reddit.com/r/boyslove/comments/13zebek/what_are_your_favourite_grumpysunshine/","r/boyslove","64815","According-Educator29","2.408219178082192","219","3590","28","https://reddit.com/user/According-Educator29/"
"2023-05-02","01:14:07","grumpy march 7th","link","Original Content","3409","23","0","neutral","https://reddit.com/r/HonkaiStarRail/comments/135773l/grumpy_march_7th/","r/HonkaiStarRail","342168","meiwsu","2.5095890410958903","9537","492","1120","https://reddit.com/user/meiwsu/"
"2022-10-10","14:18:26","Adderall Grumpiness when it wears off","text","Tips & Techniques ","19","31","0","neutral","https://reddit.com/r/adhdwomen/comments/y0fye8/adderall_grumpiness_when_it_wears_off/","r/adhdwomen","229435","Barnacle-Difficult","2.871232876712329","11","0","0","https://reddit.com/user/Barnacle-Difficult/"
"2023-06-07","22:11:29","Grumpy Old Guardians - Looking for new members","text","PC","12","31","0","neutral","https://reddit.com/r/Fireteams/comments/143qpvw/grumpy_old_guardians_looking_for_new_members/","r/Fireteams","119376","Butta_Nard","0.0136986301369863","4","0","0","https://reddit.com/user/Butta_Nard/"
"2023-05-04","00:43:52","CS has made me grumpy","text","Rant","357","55","0","neutral","https://reddit.com/r/csMajors/comments/1374wax/cs_has_made_me_grumpy/","r/csMajors","178923","callmebigbrain","1.7506849315068493","2480","1762","414","https://reddit.com/user/callmebigbrain/"
"2023-05-15","19:07:52","Anyone from Indiana, more specific, El Dorado, my cat had got out a few nights ago and I can’t find him anywhere. He’s a shorthair orange tabby, named Lucifer. He’s relatively mid sized, very lean. He has a grumpy look on him too. Please if anybody sees him or finds him message me. He has no collar.","link","Only In Indiana","243","32","0","neutral","https://reddit.com/r/Indiana/comments/13ih73f/anyone_from_indiana_more_specific_el_dorado_my/","r/Indiana","264336","Koettswoah","1.063013698630137","196","49","0","https://reddit.com/user/Koettswoah/"
"2023-06-09","13:51:52","Familiar Friday. Please post pictures of your magical friends today. I woke up the Mau for this pic, which is why she looks kinda grumpy.","link","Familiar Friday","46","11","0","neutral","https://reddit.com/r/elderwitches/comments/1455uih/familiar_friday_please_post_pictures_of_your/","r/elderwitches","7342","kai-ote","3.3232876712328765","384672","94652","27097","https://reddit.com/user/kai-ote/"
"2023-06-06","12:40:03","Our grumpy rescue ❤️ And (another) a cautionary tale","link","","93","11","0","neutral","https://reddit.com/r/Hedgehog/comments/142espp/our_grumpy_rescue_and_another_a_cautionary_tale/","r/Hedgehog","91316","Subject-Cheesecake-7","2.978082191780822","213","8","0","https://reddit.com/user/Subject-Cheesecake-7/"
"2022-10-27","13:26:12","What's Your Grumpiness Score?","text","","1","19","0","neutral","https://reddit.com/r/AskReddit/comments/yerxy6/whats_your_grumpiness_score/","r/AskReddit","41303184","dreamingonastar1","1.0657534246575342","14559","4954","606","https://reddit.com/user/dreamingonastar1/"
"2023-05-04","14:18:49","Meet Nunu and Zizi. Only one year old but so grumpy looking.","link","Tzu Pics","704","36","0","neutral","https://reddit.com/r/Shihtzu/comments/137m1rh/meet_nunu_and_zizi_only_one_year_old_but_so/","r/Shihtzu","39614","Minhyukmonbebe","3.627397260273973","710","5","0","https://reddit.com/user/Minhyukmonbebe/"
"2023-06-10","16:43:48","Grumpy bed head/Pretty kitty","link","","555","3","0","neutral","https://reddit.com/r/CalicoKittys/comments/1464wfz/grumpy_bed_headpretty_kitty/","r/CalicoKittys","42495","NoObliviotz","5.550684931506849","7156","1597","21","https://reddit.com/user/NoObliviotz/"
"2023-05-25","00:05:54","mmc who seem dominant based on their personality (grumpy, cold, etc) but are actually pretty submissive during the smut","text","Book Request","53","31","0","neutral","https://reddit.com/r/RomanceBooks/comments/13r2c2r/mmc_who_seem_dominant_based_on_their_personality/","r/RomanceBooks","175043","chaeriixo","0.8054794520547945","698","793","0","https://reddit.com/user/chaeriixo/"
