"Date","Time","Post text","Post type","Flair","# upvotes","# comments","# awards","Post tone","Post URL","Community name","Community members","Author nick","Years of membership","# Post Karma","# Comment Karma","# Awardee Karma","Author profile URL"
"2022-11-23","18:37:50","Tony Garcia on Twitter: BREAKING: Charges have been filed against 7 MSU football players for their involvement in the tunnel melee against Michigan players on Oct. 29 Khary Crump being charged with felonious assault, Jacoby Windon assault & battery, 5 others with aggravated assault.","link","News","9494","1886","8","neutral","https://reddit.com/r/CFB/comments/z2wudf/tony_garcia_on_twitter_breaking_charges_have_been/","r/CFB","1941989","reasonableoption","12.484931506849316","53258","6849","524","https://reddit.com/user/reasonableoption/"
"2023-05-24","16:23:42","Man arrested following random aggravated assault in downtown Toronto","text","","18","8","0","neutral","https://reddit.com/r/realTO/comments/13qq7ed/man_arrested_following_random_aggravated_assault/","r/realTO","1233","origutamos","0.3452054794520548","3400","1601","52","https://reddit.com/user/origutamos/"
"2023-05-06","02:01:49","Is Baizhu a must pull for aggravate Cyno?","text","Question","20","27","0","neutral","https://reddit.com/r/CynoMains/comments/1398p2s/is_baizhu_a_must_pull_for_aggravate_cyno/","r/CynoMains","21809","mekuri_mekuru","5.145205479452055","4206","6167","336","https://reddit.com/user/mekuri_mekuru/"
"2023-06-02","11:26:34","ELI5: How exactly does barometric pressure work in regard to inducing or aggravating joint pain, is it caused by rising/falling pressure or simply high vs low?","text","Planetary Science","4","8","0","neutral","https://reddit.com/r/explainlikeimfive/comments/13y9zr5/eli5_how_exactly_does_barometric_pressure_work_in/","r/explainlikeimfive","22291763","Igloo-Pincher","0.2493150684931507","4850","950","73","https://reddit.com/user/Igloo-Pincher/"
"2023-05-25","04:54:38","Should I pull Al Hathiem for Yae Miko aggravate, or just use the Tighnari I have now?","text","Gameplay","2","19","0","neutral","https://reddit.com/r/YaeMiko/comments/13r8b3u/should_i_pull_al_hathiem_for_yae_miko_aggravate/","r/YaeMiko","43825","SpikefaceMysteryfish","2.1232876712328768","98","288","15","https://reddit.com/user/SpikefaceMysteryfish/"
"2023-06-03","08:29:05","C0 Yae aggravate abyss 3.7 NO-HIT clear","video","Gameplay","10","5","0","neutral","https://reddit.com/r/YaeMikoShrine/comments/13z5yis/c0_yae_aggravate_abyss_37_nohit_clear/","r/YaeMikoShrine","7827","azizilou","6.8712328767123285","13244","3530","53","https://reddit.com/user/azizilou/"
"2023-06-05","15:11:02","Conservative MP Bob Stewart charged with threatening behaviour in relation to 'racially aggravated' incident","link","","35","2","0","neutral","https://reddit.com/r/ukpolitics/comments/141hnfx/conservative_mp_bob_stewart_charged_with/","r/ukpolitics","468768","IWantMyJustDesserts","5.980821917808219","32605","8952","583","https://reddit.com/user/IWantMyJustDesserts/"
"2023-06-08","08:25:54","RaidenMiko aggravate","video","Gameplay","21","2","0","neutral","https://reddit.com/r/YaeMiko/comments/1443dgz/raidenmiko_aggravate/","r/YaeMiko","43825","yuyucg","3.232876712328767","110","151","0","https://reddit.com/user/yuyucg/"
"2023-05-03","02:15:14","Annoyed. Irritated. Aggravated. Vexed","link","","25","22","0","neutral","https://reddit.com/r/idleon/comments/1367meu/annoyed_irritated_aggravated_vexed/","r/idleon","23187","OborJSins","1.6712328767123288","106","19","0","https://reddit.com/user/OborJSins/"
"2023-06-08","16:09:11","Crazy difference in reaction damage, Aggravate/Spread vs Hyperbloom","text","Discussion","0","10","0","neutral","https://reddit.com/r/Genshin_Impact/comments/144dd0m/crazy_difference_in_reaction_damage/","r/Genshin_Impact","1953528","arseholierthanthou","3.3424657534246576","1612","94587","1938","https://reddit.com/user/arseholierthanthou/"
"2023-05-07","17:46:23","Last Week I made a small demo of Keqing and Baizhu Aggravate. I made a small follow-up video explaining why Baizhu is great with Keqing and Quicken teams!","video","Guides","95","10","0","neutral","https://reddit.com/r/BaizhuMains/comments/13axg56/last_week_i_made_a_small_demo_of_keqing_and/","r/BaizhuMains","11931","AzraelA9","6.2246575342465755","2583","1977","126","https://reddit.com/user/AzraelA9/"
"2023-06-05","15:00:09","Tory MP Bob Stewart charged with racially aggravated behaviour | ITV News","link","","28","2","0","neutral","https://reddit.com/r/ukpolitics/comments/141haw5/tory_mp_bob_stewart_charged_with_racially/","r/ukpolitics","468768","LeftWingScot","6.586301369863014","388342","268751","1052","https://reddit.com/user/LeftWingScot/"
"2023-05-04","01:33:15","Nahida-less Cyno Aggravate ft. Baizhu, Kazuha, Fischl on 12-1-1","video","Media","68","11","0","neutral","https://reddit.com/r/CynoMains/comments/1375zbh/nahidaless_cyno_aggravate_ft_baizhu_kazuha_fischl/","r/CynoMains","21809","M_Kropnix","6.504109589041096","6105","3843","131","https://reddit.com/user/M_Kropnix/"
"2023-06-06","12:56:02","And the winner was DIO vs Reverse Flash, requested by u/Aggravating_Floor_76! Congrats to those who won, and better luck next time for those who unfortunately lost.","link","Fight Script","3","5","0","neutral","https://reddit.com/r/DeathBattleMatchups/comments/142f7q9/and_the_winner_was_dio_vs_reverse_flash_requested/","r/DeathBattleMatchups","16195","PeeEssEye","2.4","1495","3462","123","https://reddit.com/user/PeeEssEye/"
