"Date","Time","Post text","Post type","Flair","# upvotes","# comments","# awards","Post tone","Post URL","Community name","Community members","Author nick","Years of membership","# Post Karma","# Comment Karma","# Awardee Karma","Author profile URL"
"2023-04-28","16:53:28","Do you ever feel like fishing, especially kayak fishing is more hassle and aggravation than it’s worth?","text","","88","161","0","neutral","https://reddit.com/r/kayakfishing/comments/1321n17/do_you_ever_feel_like_fishing_especially_kayak/","r/kayakfishing","158942","Peon-Flux","0.2493150684931507","7619","1099","18","https://reddit.com/user/Peon-Flux/"
"2023-06-07","16:34:35","Alumni Association aggravation","text","","23","19","0","neutral","https://reddit.com/r/Gamecocks/comments/143i0cl/alumni_association_aggravation/","r/Gamecocks","14146","SeaSpur","10.156164383561643","2034","15991","136","https://reddit.com/user/SeaSpur/"
"2023-06-03","08:22:48","C0 Yae aggravate abyss 3.7 NO-HIT clear","video","Media","2728","191","0","neutral","https://reddit.com/r/Genshin_Impact/comments/13z5u0l/c0_yae_aggravate_abyss_37_nohit_clear/","r/Genshin_Impact","1952881","azizilou","6.8712328767123285","13245","3535","53","https://reddit.com/user/azizilou/"
"2023-05-30","16:48:28","Aggravation in helping people","text","","2","17","0","neutral","https://reddit.com/r/allthemods/comments/13vvelh/aggravation_in_helping_people/","r/allthemods","30657","sevendet","10.068493150684931","19","52","0","https://reddit.com/user/sevendet/"
"2023-05-10","21:43:31","Low Fuel Motorsport, is it worth the aggravation & grind?","text","Discussion :icon:","3","22","0","neutral","https://reddit.com/r/ACCompetizione/comments/13e499n/low_fuel_motorsport_is_it_worth_the_aggravation/","r/ACCompetizione","64390","IrkMe","5.534246575342466","3","22","0","https://reddit.com/user/IrkMe/"
"2023-06-07","12:47:34","Just an aggravation.","text","Rant/Vent","0","4","0","neutral","https://reddit.com/r/BabyBumps/comments/143cc3q/just_an_aggravation/","r/BabyBumps","354333","Bubbly-Hugs","0.7506849315068493","203","180","0","https://reddit.com/user/Bubbly-Hugs/"
"2023-06-09","19:14:56","Daryl Stagg, 60, mission strategist for the Big Creek and CenLa Baptist associations, has been charged w 3 counts each of oral sexual battery, first degree rape, aggravated crimes against nature & indecent behavior with juveniles.","link","","1673","69","0","neutral","https://reddit.com/r/MarchAgainstNazis/comments/145e1h8/daryl_stagg_60_mission_strategist_for_the_big/","r/MarchAgainstNazis","152164","MsSeraphim","1.252054794520548","195539","110282","974","https://reddit.com/user/MsSeraphim/"
"2023-05-30","02:45:44","Uganda greenlights death penalty for 'aggravated homosexuality' in controversial crackdown","link","","532","225","0","neutral","https://reddit.com/r/Conservative/comments/13veais/uganda_greenlights_death_penalty_for_aggravated/","r/Conservative","1040871","jgeorge20","3.767123287671233","233742","8016","11093","https://reddit.com/user/jgeorge20/"
"2023-05-08","14:08:06","Anyone else deal with extreme aggravation in early sobriety?","text","","20","9","0","neutral","https://reddit.com/r/stopdrinking/comments/13bqulk/anyone_else_deal_with_extreme_aggravation_in/","r/stopdrinking","443968","smo0621","0.7068493150684931","870","265","55","https://reddit.com/user/smo0621/"
"2023-05-17","13:24:22","Are dating apps really worth the aggravation?","text","","5","10","0","neutral","https://reddit.com/r/IndianBoysOnTinder/comments/13k1o7l/are_dating_apps_really_worth_the_aggravation/","r/IndianBoysOnTinder","62060","ConsumedByDeath","6.501369863013698","353","1605","15","https://reddit.com/user/ConsumedByDeath/"
"2023-05-03","13:59:05","[KCTV5] Jackson Mahomes arrested, accused of aggravated sexual battery.","link","ANALYSIS & NEWS","1118","608","0","neutral","https://reddit.com/r/KansasCityChiefs/comments/136lb87/kctv5_jackson_mahomes_arrested_accused_of/","r/KansasCityChiefs","188741","Fair_Abroad_6194","2.243835616438356","4028","6074","104","https://reddit.com/user/Fair_Abroad_6194/"
"2023-05-20","07:58:15","Research on: Video Game Categories that Cause Aggravation","link","Academic-Personal","1","3","0","neutral","https://reddit.com/r/takemysurvey/comments/13mlmzu/research_on_video_game_categories_that_cause/","r/takemysurvey","13498","BeBopTm","6.071232876712329","1436","462","62","https://reddit.com/user/BeBopTm/"
"2023-05-23","17:44:02","How To Prove Service Aggravation?","text","VA Disability Claims :claim:","0","9","0","neutral","https://reddit.com/r/VeteransBenefits/comments/13pvds2/how_to_prove_service_aggravation/","r/VeteransBenefits","75122","Mythion","6.36986301369863","7051","3633","151","https://reddit.com/user/Mythion/"
"2023-06-11","22:03:13","Deaf Radio - Aggravation (Official Audio)","link","","1","0","0","neutral","https://reddit.com/r/u_Korena_Maller_6827/comments/1476tvx/deaf_radio_aggravation_official_audio/","u/Korena_Maller_6827","0","Korena_Maller_6827","1.358904109589041","1","2","0","https://reddit.com/user/Korena_Maller_6827/"
"2023-03-29","19:59:50","To not get arrested. Ends up with 7 more charges including aggravated battery of a peace officer","video","","7707","1384","0","neutral","https://reddit.com/r/therewasanattempt/comments/125yyi9/to_not_get_arrested_ends_up_with_7_more_charges/","r/therewasanattempt","6368813","diamondsodacoma","4.093150684931507","73198","12241","528","https://reddit.com/user/diamondsodacoma/"
"2023-06-08","15:50:18","A quality managed services provider can save your business money and aggravation.","text","","1","0","0","neutral","https://reddit.com/r/u_dtsolutions1/comments/144cur3/a_quality_managed_services_provider_can_save_your/","u/dtsolutions1","0","dtsolutions1","0.010958904109589041","1","0","0","https://reddit.com/user/dtsolutions1/"
"2023-05-16","09:30:59","Everyone aggravated that my child is obsessed with me","text","","591","153","0","neutral","https://reddit.com/r/breastfeeding/comments/13j09gu/everyone_aggravated_that_my_child_is_obsessed/","r/breastfeeding","120624","Ill_Sorbet_2040","2.3643835616438356","532","1876","10","https://reddit.com/user/Ill_Sorbet_2040/"
"2023-05-17","07:35:42","Kris making this face whenever she tries to play the victim aggravates my soul.","link","Meme","472","169","0","neutral","https://reddit.com/r/90DayFiance/comments/13jutbj/kris_making_this_face_whenever_she_tries_to_play/","r/90DayFiance","389606","Medium_Pomegranate85","1.2657534246575342","1388","1506","10","https://reddit.com/user/Medium_Pomegranate85/"
"2023-04-06","15:59:18","Summoner Succumbs to Stupid Staircase Stumble - Advice to Avoid Aggravation","text","","30","18","0","neutral","https://reddit.com/r/dcss/comments/12dooqh/summoner_succumbs_to_stupid_staircase_stumble/","r/dcss","11879","actuatedarbalest","6.054794520547945","46","37144","271","https://reddit.com/user/actuatedarbalest/"
"2023-06-05","20:06:14","need legal advice. killed my tenant for aggravated bisexualism. what is my next move?","link","","602","41","0","neutral","https://reddit.com/r/LoveForLandchads/comments/141q3bz/need_legal_advice_killed_my_tenant_for_aggravated/","r/LoveForLandchads","29183","Furryismwitch","2.2356164383561645","3456","71","0","https://reddit.com/user/Furryismwitch/"
"2023-04-04","03:58:15","For any record collectors or cult cinema fans in town, Aggravation Place is open on High Street down at the post office end of town. Go and see Benson and spend some cash. Heavy punk leaning but prices are the best I’ve seen in a record shop for ages. Tuesday to Sunday, 11-5.","link","","33","10","0","neutral","https://reddit.com/r/maitland/comments/12b8d9q/for_any_record_collectors_or_cult_cinema_fans_in/","r/maitland","654","RogerKilljoy83","1.7205479452054795","2793","5201","139","https://reddit.com/user/RogerKilljoy83/"
"2023-05-28","10:48:57","New Zeri Trinity build is really aggravating to play against.","text","","106","155","0","neutral","https://reddit.com/r/leagueoflegends/comments/13txfto/new_zeri_trinity_build_is_really_aggravating_to/","r/leagueoflegends","6408832","Odkrywacz","5.008219178082192","49399","152605","1428","https://reddit.com/user/Odkrywacz/"
"2023-05-13","03:04:34","HLR: OSA Secondary to PTSD w/Unspec Depressive Disorder Aggravation Opinion Sent to QTC for the 4th Time!","text","VA Disability Claims :claim:","0","7","0","neutral","https://reddit.com/r/VeteransBenefits/comments/13g5fxu/hlr_osa_secondary_to_ptsd_wunspec_depressive/","r/VeteransBenefits","75122","markinituphuck","2.3917808219178083","1601","2617","378","https://reddit.com/user/markinituphuck/"
"2023-05-22","11:00:19","Research on: Video Game Categories that Cause Aggravation","link","Academic-Personal","1","2","0","neutral","https://reddit.com/r/takemysurvey/comments/13onn5b/research_on_video_game_categories_that_cause/","r/takemysurvey","13498","BeBopTm","6.071232876712329","1436","462","62","https://reddit.com/user/BeBopTm/"
"2023-05-20","19:16:36","Minor Damage! Major Aggravation!","text","","2","3","0","neutral","https://reddit.com/r/Dorsoduro_900/comments/13n3jdd/minor_damage_major_aggravation/","r/Dorsoduro_900","13","SuperDooper900","0.12054794520547946","54","286","0","https://reddit.com/user/SuperDooper900/"
"2022-12-26","21:47:46","Are Boxing Day sales worth the aggravation?","text","Credit","168","181","0","neutral","https://reddit.com/r/PersonalFinanceCanada/comments/zvxv9j/are_boxing_day_sales_worth_the_aggravation/","r/PersonalFinanceCanada","1186353","JewishSpace_Laser","2.361643835616438","1171","13863","118","https://reddit.com/user/JewishSpace_Laser/"
"2023-05-18","10:12:26","[ACADEMIC SURVEY] 3-5 Min Survey about Research on: Video Game Categories that Cause Aggravation","text","","2","3","0","neutral","https://reddit.com/r/SurveyExchange/comments/13kulge/academic_survey_35_min_survey_about_research_on/","r/SurveyExchange","16170","BeBopTm","6.071232876712329","1436","462","62","https://reddit.com/user/BeBopTm/"
"2023-05-20","07:59:52","[ACADEMIC SURVEY] 3-5 Min Survey about Research on: Video Game Categories that Cause Aggravation","text","","1","5","0","neutral","https://reddit.com/r/SurveyExchange/comments/13mlnyk/academic_survey_35_min_survey_about_research_on/","r/SurveyExchange","16170","BeBopTm","6.071232876712329","1436","462","62","https://reddit.com/user/BeBopTm/"
"2023-05-23","10:49:05","Aggravation des soupçons de fraude aux cotisations sociales pour le ministre comorien Dhoukamal","link","","1","0","0","neutral","https://reddit.com/r/Mayotte/comments/13pky9x/aggravation_des_soupçons_de_fraude_aux/","r/Mayotte","578","Nohan07","6.005479452054795","52648","2371","1037","https://reddit.com/user/Nohan07/"
"2023-05-30","14:15:36","An Aggravating Day At Punk Rock Bowling - Dumb Rules & Wasted Money - Fr...","link","Walk & Talk Warning!","18","157","0","neutral","https://reddit.com/r/Adamthewoocriticism/comments/13vrif0/an_aggravating_day_at_punk_rock_bowling_dumb/","r/Adamthewoocriticism","661","Successful-Artist441","1.16986301369863","39","669","0","https://reddit.com/user/Successful-Artist441/"
"2023-06-09","12:20:18","LEGO The Hobbit: The Aggravation of Smaug","link","","1","0","0","neutral","https://reddit.com/r/u_RiaVardaman7826/comments/1453qck/lego_the_hobbit_the_aggravation_of_smaug/","u/RiaVardaman7826","0","RiaVardaman7826","0.4301369863013699","1","0","0","https://reddit.com/user/RiaVardaman7826/"
"2023-04-17","13:14:05","I’m thinking any pour bagged or even ready mixed and priced under $2,500 is hardly worth the aggravation. There’s permits, equipment, gas, forms, dump fees, load fees and laborers. Not saying skip the small jobs either, just that I’m not in a race to go broke. Where’s your limit?","text","Pro With a Question","14","8","0","neutral","https://reddit.com/r/Concrete/comments/12pfkh0/im_thinking_any_pour_bagged_or_even_ready_mixed/","r/Concrete","22392","GSLandscaping2019","0.40273972602739727","25","63","0","https://reddit.com/user/GSLandscaping2019/"
"2023-05-18","16:55:24","My next door business neighbours are a constant source of aggravation and belligerence.","text","Not looking for advice or input","2","0","0","neutral","https://reddit.com/r/Vent/comments/13l4c6f/my_next_door_business_neighbours_are_a_constant/","r/Vent","163952","TmF1979","7.567123287671233","4380","17234","275","https://reddit.com/user/TmF1979/"
"2023-05-12","20:46:45","Female Arrested for Aggravated Battery after Attempting to Stab a Deputy with a Fix-a-Flat Tool","video","👮Arrest Freakout","757","91","0","neutral","https://reddit.com/r/PublicFreakout/comments/13fwl67/female_arrested_for_aggravated_battery_after/","r/PublicFreakout","4544625","ThisIsButter1","0.9917808219178083","28313","731","150","https://reddit.com/user/ThisIsButter1/"
"2023-05-03","15:58:16","Jackson Mahomes arrested, faces aggravated sexual battery charges","text","","358","209","0","neutral","https://reddit.com/r/PatMcAfeeShowOfficial/comments/136rckx/jackson_mahomes_arrested_faces_aggravated_sexual/","r/PatMcAfeeShowOfficial","18556","factsdino","4.1808219178082195","248","271","0","https://reddit.com/user/factsdino/"
"2023-05-18","10:13:08","Research on: Video Game Categories that Cause Aggravation","link","Academic-Personal","1","2","0","neutral","https://reddit.com/r/takemysurvey/comments/13kulzb/research_on_video_game_categories_that_cause/","r/takemysurvey","13498","BeBopTm","6.071232876712329","1436","462","62","https://reddit.com/user/BeBopTm/"
"2023-06-05","15:08:35","Bob Stewart: Conservative MP charged with racially aggravated abuse","link","","189","25","0","neutral","https://reddit.com/r/ukpolitics/comments/141hko5/bob_stewart_conservative_mp_charged_with_racially/","r/ukpolitics","468760","Roguepope","10.756164383561643","21734","96730","2014","https://reddit.com/user/Roguepope/"
"2023-05-21","00:45:40","This just aggravates me","link","","32","166","0","neutral","https://reddit.com/r/tiktoklesbiandrama/comments/13ne6bo/this_just_aggravates_me/","r/tiktoklesbiandrama","14591","Exciting-Spend-8752","1.1479452054794521","77","1053","0","https://reddit.com/user/Exciting-Spend-8752/"
"2023-01-22","21:19:18","I don’t knead this aggravation","video","","1192","23","0","neutral","https://reddit.com/r/StartledCats/comments/10iuk8v/i_dont_knead_this_aggravation/","r/StartledCats","1514551","alancar","13.446575342465753","18291","7171","65","https://reddit.com/user/alancar/"
"2023-06-09","18:15:26","Daryl Stagg, 60, mission strategist for the Big Creek and CenLa Baptist associations, has been charged w 3 counts each of oral sexual battery, first degree rape, aggravated crimes against nature & indecent behavior with juveniles.","link","","136","16","0","neutral","https://reddit.com/r/TheLib/comments/145cjo1/daryl_stagg_60_mission_strategist_for_the_big/","r/TheLib","9177","EugeneWong318","1.8767123287671232","2720487","23584","21181","https://reddit.com/user/EugeneWong318/"
"2023-05-23","16:00:34","Florida man charged with aggravated DWI after being clocked at 171 mph on motorcycle in NH","link","","551","35","0","neutral","https://reddit.com/r/FloridaMan/comments/13psmgb/florida_man_charged_with_aggravated_dwi_after/","r/FloridaMan","772581","t800x","6.616438356164384","141658","888","454","https://reddit.com/user/t800x/"
"2023-05-24","01:56:14","U.S. Mortgage Requirement Window Aggravation","text","Planning","0","1","0","neutral","https://reddit.com/r/personalfinance/comments/13q7s5j/us_mortgage_requirement_window_aggravation/","r/personalfinance","17825124","MoodyCPU","4.780821917808219","858","362","0","https://reddit.com/user/MoodyCPU/"
"2023-05-21","16:33:49","[World] - G7 seen as key factor of aggravation of global problems — Russian foreign ministry","link","","1","0","0","neutral","https://reddit.com/r/SANAauto/comments/13nziip/world_g7_seen_as_key_factor_of_aggravation_of/","r/SANAauto","61","AutoNewsAdmin","6.627397260273972","309102","10","6378","https://reddit.com/user/AutoNewsAdmin/"
"2023-05-21","16:50:01","[World] - G7 seen as key factor of aggravation of global problems — Russian foreign ministry | SANA","link","","1","0","0","neutral","https://reddit.com/r/AutoNewspaper/comments/13nzwph/world_g7_seen_as_key_factor_of_aggravation_of/","r/AutoNewspaper","17713","AutoNewspaperAdmin","6.6219178082191785","294752","1","2101","https://reddit.com/user/AutoNewspaperAdmin/"
"2023-06-06","19:07:41","Something is very much off 🥴 she got aggravated & impatient at the end slamming the floor and blocks like that. No toys, no chairs, nothing ","video","","22","48","0","neutral","https://reddit.com/r/independentshanika/comments/142q5vw/something_is_very_much_off_she_got_aggravated/","r/independentshanika","2400","mo_dahmer","4.2904109589041095","4913","25570","45","https://reddit.com/user/mo_dahmer/"
"2023-05-14","02:25:47","Aggravation from talking","text","","1","2","0","neutral","https://reddit.com/r/hyperacusis/comments/13gzz4o/aggravation_from_talking/","r/hyperacusis","2613","RelativeLow5375","2.591780821917808","130","102","20","https://reddit.com/user/RelativeLow5375/"
"2023-02-03","20:04:25","customer aggravates worker to the point of her quitting","video","","14454","1818","0","neutral","https://reddit.com/r/PublicFreakout/comments/10stq94/customer_aggravates_worker_to_the_point_of_her/","r/PublicFreakout","4544625","giga_grenade","3.389041095890411","92331","71588","1179","https://reddit.com/user/giga_grenade/"
"2023-05-12","18:42:27","Noor Mohamed Aden, 22, and Jaheim Whiting, 21, were changed with aggravated attempted murder and conspiracy to commit murder. Abukar Abdi, 22, and Jabrie Myers, 21, were charged with conspiracy to commit murder.","link","","59","118","0","neutral","https://reddit.com/r/portlandme/comments/13ftfk1/noor_mohamed_aden_22_and_jaheim_whiting_21_were/","r/portlandme","32205","207Celtics","6.942465753424657","957","2643","160","https://reddit.com/user/207Celtics/"
"2023-05-25","21:58:05","Anyone else having this glitch?? Events or items you’ve run out of aren’t greyed out anymore. Not a problem just aggravates my ocd side","link","","75","33","0","neutral","https://reddit.com/r/LegendofSlime/comments/13rupaa/anyone_else_having_this_glitch_events_or_items/","r/LegendofSlime","10481","Lordoffancy","6.13972602739726","1243","2021","15","https://reddit.com/user/Lordoffancy/"
"2023-04-06","07:37:11","Aggravation, by Suzanne Helmigh","link","","83","1","0","neutral","https://reddit.com/r/ImaginaryWitches/comments/12dcjyv/aggravation_by_suzanne_helmigh/","r/ImaginaryWitches","49458","sylvyrfyre","8.372602739726027","907341","16870","8969","https://reddit.com/user/sylvyrfyre/"
"2023-05-08","14:13:47","r/DeathBattleMatchups Collagé Day 181: DIO VS Beatrice! Request by u/Aggravating_Floor_76! Sorry for being late, it wasn't my fault this time, Reddit was fucking up on my end. Anyway, you know the rules.","link","Matchup Art","46","122","0","neutral","https://reddit.com/r/DeathBattleMatchups/comments/13br8a2/rdeathbattlematchups_collagé_day_181_dio_vs/","r/DeathBattleMatchups","16193","breadbybread","2.0767123287671234","46763","25140","534","https://reddit.com/user/breadbybread/"
"2023-03-19","01:07:48","Airline Aggravation: A Turbulent Tale (An Epic: Abridged)","text","Short","36","6","0","neutral","https://reddit.com/r/TalesFromTheCustomer/comments/11v6v1b/airline_aggravation_a_turbulent_tale_an_epic/","r/TalesFromTheCustomer","291812","miss_nephthys","6.841095890410959","59520","46797","810","https://reddit.com/user/miss_nephthys/"
"2023-06-05","23:10:59","…Mennard. And Glammike. Two things that aggravate me.","link","Fandom Cringe","50","19","0","neutral","https://reddit.com/r/GachaClubCringe/comments/141vi1x/mennard_and_glammike_two_things_that_aggravate_me/","r/GachaClubCringe","44413","TheBoyInGray","2.3013698630136985","33078","4470","152","https://reddit.com/user/TheBoyInGray/"
"2023-05-22","10:59:57","[ACADEMIC SURVEY] 3-5 Min Survey about Research on: Video Game Categories that Cause Aggravation","text","","1","1","0","neutral","https://reddit.com/r/SurveyExchange/comments/13onmtn/academic_survey_35_min_survey_about_research_on/","r/SurveyExchange","16173","BeBopTm","6.071232876712329","1436","462","62","https://reddit.com/user/BeBopTm/"
"2023-05-13","21:58:49","Constant fighting and aggravation, help?","text","","1","1","0","neutral","https://reddit.com/r/family/comments/13gtzu0/constant_fighting_and_aggravation_help/","r/family","295967","Krowboness","0.4273972602739726","1","0","0","https://reddit.com/user/Krowboness/"
"2023-05-26","21:23:28","C0 yae aggravate floor 12 no damage taken","video","Media","85","22","0","neutral","https://reddit.com/r/Genshin_Impact/comments/13sowsr/c0_yae_aggravate_floor_12_no_damage_taken/","r/Genshin_Impact","1953495","azizilou","6.8712328767123285","13244","3530","53","https://reddit.com/user/azizilou/"
"2023-06-07","00:30:22","Anyone else extremely aggravated with Planet Fitness?","text","","19","19","0","neutral","https://reddit.com/r/astoria/comments/142y8vo/anyone_else_extremely_aggravated_with_planet/","r/astoria","57564","JuryForsaken2482","1.4821917808219178","43","72","0","https://reddit.com/user/JuryForsaken2482/"
"2023-06-01","01:41:25","r/DeathBattleMatchups Season List Day 76: Shin Megami Tensei! Requested by u/Aggravating_Floor_76! Very fitting that the user's number goes alongside the day. Comment franchises below & the most upvoted will get a season list. Read Rules Before Commenting!","link","Matchup Art","38","24","0","neutral","https://reddit.com/r/DeathBattleMatchups/comments/13x4se9/rdeathbattlematchups_season_list_day_76_shin/","r/DeathBattleMatchups","16195","Ordinary_Stress9431","2.4794520547945207","4936","2170","50","https://reddit.com/user/Ordinary_Stress9431/"
"2023-01-20","15:15:06","Meet my Chaos Bucket! I have one like this in almost every room. If it’s clutter, a project/problem, or “deal with it later”, it goes here. Biweekly, I address the chaos buckets, toss stuff that’s not worth the aggravation, fix fixable things, and put away everything else!","link","Cleaning, Organizing, Decluttering","158","22","0","neutral","https://reddit.com/r/adhdwomen/comments/10gzfqq/meet_my_chaos_bucket_i_have_one_like_this_in/","r/adhdwomen","229367","kflan138","5.227397260273973","330","5624","58","https://reddit.com/user/kflan138/"
"2023-05-08","05:44:01","Will there be an aggravation on May 9: the Ministry of Defense dotted the ""i""","link","","1","0","0","neutral","https://reddit.com/r/u_NewsBestLive/comments/13bfd7k/will_there_be_an_aggravation_on_may_9_the/","u/NewsBestLive","0","NewsBestLive","1.8054794520547945","1306","0","18","https://reddit.com/user/NewsBestLive/"
"2023-03-23","19:13:22","White House threatens to pull aid to Uganda over anti-LGBTQ bill. The proposed law calls for penalties up to life in prison and even the death sentence for what is described as “aggravated homosexuality.”","link","","2010","196","0","neutral","https://reddit.com/r/politics/comments/11zu69k/white_house_threatens_to_pull_aid_to_uganda_over/","r/politics","8336621","southpawFA","7.342465753424658","1881901","390190","41607","https://reddit.com/user/southpawFA/"
"2023-05-30","15:51:34","Biden, Cruz condemn Uganda law allowing death penalty for 'aggravated homosexuality' | Fox News","link","","26","23","0","neutral","https://reddit.com/r/Conservative/comments/13vtxrt/biden_cruz_condemn_uganda_law_allowing_death/","r/Conservative","1040841","JesusDied4U316","3.421917808219178","3307","29832","432","https://reddit.com/user/JesusDied4U316/"
"2023-05-25","12:56:50","Words can't express how much this aggravates me","text","Discussion","51","26","0","neutral","https://reddit.com/r/systemofadown/comments/13rh340/words_cant_express_how_much_this_aggravates_me/","r/systemofadown","43933","TheBeeMovieHistorian","1.9205479452054794","22148","7082","1353","https://reddit.com/user/TheBeeMovieHistorian/"
"2023-06-04","01:52:26","I can just tell when they are using substances like they act very different when they were in Hawaii at first I’m sure they are sober but idk now every time moir is on drugs or drinking she acts different like she’s always angry or aggravated at everything and everyone, and icy we all know","link","","14","27","0","neutral","https://reddit.com/r/icywyattsnarkk/comments/13zx6rp/i_can_just_tell_when_they_are_using_substances/","r/icywyattsnarkk","3277","Successful-Score4493","0.4054794520547945","172","385","0","https://reddit.com/user/Successful-Score4493/"
"2023-06-08","16:15:10","It's so aggravating 🤦‍♂️","link","","102","7","0","neutral","https://reddit.com/r/lgbt/comments/144dijz/its_so_aggravating/","r/lgbt","1027954","A_Mirabeau_702","6.682191780821918","17090","46937","914","https://reddit.com/user/A_Mirabeau_702/"
"2023-05-24","12:26:15","My Keqing’s aggravate team (and my old build). What do you think about it?","link","Discussion","28","36","0","neutral","https://reddit.com/r/KeqingMains/comments/13qk5wy/my_keqings_aggravate_team_and_my_old_build_what/","r/KeqingMains","66865","energy_j","1.7917808219178082","219","2231","20","https://reddit.com/user/energy_j/"
"2023-05-18","12:25:19","3.6 Abyss Top Half 71 secs Keqing Aggravate ","video","Discussion","144","22","0","neutral","https://reddit.com/r/KeqingMains/comments/13kxoqi/36_abyss_top_half_71_secs_keqing_aggravate/","r/KeqingMains","66865","taylor_series19","3.4465753424657533","1497","6363","121","https://reddit.com/user/taylor_series19/"
"2023-04-28","06:27:31","Tour d’eau : pas d’aggravation jusqu’à mi-mai","link","","1","0","0","neutral","https://reddit.com/r/Mayotte/comments/131jo3v/tour_deau_pas_daggravation_jusquà_mimai/","r/Mayotte","578","Nohan07","6.005479452054795","52656","2371","1037","https://reddit.com/user/Nohan07/"
